{
  "version": "1.0.0",
  "scan_metadata": {
    "scan_timestamp": "2025-11-20T14:30:00Z",
    "image_source": "/scans/student_s001_version_v1.jpg",
    "image_hash": "sha256:a3b2c1d4e5f6789...",
    "scanner_version": "imagescan-1.0.0",
    "processing_time_ms": 1245.7
  },
  "identification": {
    "version_id": "v1",
    "student_id": "s001",
    "confidence": {
      "version_id": 0.98,
      "student_id": 0.95
    }
  },
  "rectification": {
    "markers_detected": 4,
    "markers_expected": 4,
    "rectification_applied": true,
    "skew_angle": -2.3,
    "quality_score": 0.92
  },
  "answers": [
    {
      "question_id": "q1",
      "question_type": "multiple_choice",
      "extracted_answer": "B",
      "confidence": 0.97,
      "raw_data": {
        "fill_percentages": {
          "A": 0.05,
          "B": 0.89,
          "C": 0.02,
          "D": 0.03
        }
      },
      "warnings": [],
      "flags": {
        "needs_review": false,
        "multiple_answers": false,
        "no_answer": false,
        "ambiguous": false
      }
    },
    {
      "question_id": "q2",
      "question_type": "multiple_choice",
      "extracted_answer": "B",
      "confidence": 0.95,
      "raw_data": {
        "fill_percentages": {
          "A": 0.08,
          "B": 0.87,
          "C": 0.04,
          "D": 0.06
        }
      },
      "warnings": [],
      "flags": {
        "needs_review": false,
        "multiple_answers": false,
        "no_answer": false,
        "ambiguous": false
      }
    },
    {
      "question_id": "q3",
      "question_type": "short_answer",
      "extracted_answer": "Random Access Memory",
      "confidence": 0.93,
      "raw_data": {
        "ocr_text": "Random Access Memory",
        "ocr_confidence": 0.93,
        "alternative_readings": [
          {
            "text": "Random Access Mamory",
            "confidence": 0.12
          }
        ]
      },
      "warnings": [],
      "flags": {
        "needs_review": false,
        "multiple_answers": false,
        "no_answer": false,
        "ambiguous": false
      }
    },
    {
      "question_id": "q4",
      "question_type": "multiple_choice",
      "extracted_answer": "B",
      "confidence": 0.99,
      "raw_data": {
        "fill_percentages": {
          "A": 0.01,
          "B": 0.94,
          "C": 0.02,
          "D": 0.01
        }
      },
      "warnings": [],
      "flags": {
        "needs_review": false,
        "multiple_answers": false,
        "no_answer": false,
        "ambiguous": false
      }
    },
    {
      "question_id": "q5",
      "question_type": "short_answer",
      "extracted_answer": "Merge Sort",
      "confidence": 0.88,
      "raw_data": {
        "ocr_text": "Merge Sort",
        "ocr_confidence": 0.88,
        "alternative_readings": [
          {
            "text": "Marge Sort",
            "confidence": 0.15
          },
          {
            "text": "Merge Sorl",
            "confidence": 0.08
          }
        ]
      },
      "warnings": [],
      "flags": {
        "needs_review": false,
        "multiple_answers": false,
        "no_answer": false,
        "ambiguous": false
      }
    },
    {
      "question_id": "q6",
      "question_type": "true_false",
      "extracted_answer": "A",
      "confidence": 0.96,
      "raw_data": {
        "fill_percentages": {
          "A": 0.91,
          "B": 0.04
        }
      },
      "warnings": [],
      "flags": {
        "needs_review": false,
        "multiple_answers": false,
        "no_answer": false,
        "ambiguous": false
      }
    },
    {
      "question_id": "q7",
      "question_type": "multiple_choice",
      "extracted_answer": "C",
      "confidence": 0.94,
      "raw_data": {
        "fill_percentages": {
          "A": 0.03,
          "B": 0.07,
          "C": 0.88,
          "D": 0.02
        }
      },
      "warnings": [],
      "flags": {
        "needs_review": false,
        "multiple_answers": false,
        "no_answer": false,
        "ambiguous": false
      }
    },
    {
      "question_id": "q8",
      "question_type": "short_answer",
      "extracted_answer": null,
      "confidence": 0.0,
      "raw_data": {
        "ocr_text": "",
        "ocr_confidence": 0.0,
        "alternative_readings": []
      },
      "warnings": [
        "no_bubble_filled"
      ],
      "flags": {
        "needs_review": true,
        "multiple_answers": false,
        "no_answer": true,
        "ambiguous": false
      }
    }
  ],
  "overall_quality": {
    "average_confidence": 0.83,
    "answers_flagged": 1,
    "scan_quality": "good"
  }
}
